questions,answers
How can machine learning be used to expand business operations?,"Machine learning can be used to analyze market trends, identify opportunities for expansion, and automate business processes, leading to increased efficiency and growth."
What are the benefits of scalable solutions in job creation?,"Scalable solutions allow businesses to grow efficiently by applying proven methods across various industries, which helps in creating more job opportunities."
How do training programs in data science help workers?,"Training programs in data science provide workers with the skills needed to handle modern technological tools and methodologies, enhancing their employability and career growth."
What certifications are valuable for machine learning?,"Certifications in machine learning validate the skills of workers, making them more attractive to employers and opening up more job opportunities."
How can machine learning optimize supply chain management?,"Machine learning can optimize supply chain management by predicting demand, managing inventory levels, and optimizing delivery routes, reducing costs and improving efficiency."
What is predictive analytics and its use in business?,"Predictive analytics uses historical data to forecast future trends, helping businesses make informed decisions, manage risks, and optimize operations."
How to develop partnerships with educational institutions?,"Develop partnerships with educational institutions by collaborating on research projects, offering internships, and providing industry insights to curriculum development."
What are community workshops and their benefits?,"Community workshops educate the community about the applications of machine learning, inspiring them to develop new skills and explore career opportunities in technology."
How can machine learning improve resource management?,Machine learning can improve resource management by analyzing usage patterns and optimizing processes to reduce waste and increase efficiency.
What are the best practices for energy efficiency?,"Best practices for energy efficiency include using machine learning models to monitor energy usage, predict maintenance needs, and optimize energy consumption."
How does data-driven insights support economic growth?,"Data-driven insights support economic growth by providing actionable information on market trends, job creation, and business performance, allowing for continuous improvement."
How to measure the economic impact of business initiatives?,"Measure the economic impact of business initiatives by collecting and analyzing data on job creation, revenue growth, and community benefits, and publish regular impact reports."
What are the steps to expand a business using technology?,"To expand a business using technology, identify key areas for improvement, implement relevant technologies, and scale successful solutions across the organization."
How to establish training programs for semi-skilled workers?,"Establish training programs for semi-skilled workers by identifying the skills needed in the industry, developing comprehensive curricula, and offering hands-on training opportunities."
What role do certifications play in employability?,"Certifications play a critical role in employability by formally recognizing the skills and knowledge of workers, making them more competitive in the job market."
How to implement process optimization in businesses?,"Implement process optimization in businesses by using machine learning models to identify inefficiencies, streamline operations, and reduce costs."
What is the role of predictive analytics in risk management?,"Predictive analytics in risk management involves using data to predict potential risks and implementing strategies to mitigate them, ensuring business continuity and stability."
How to develop collaborative projects with tech companies?,"Develop collaborative projects with tech companies by aligning goals, sharing resources, and working together on innovative solutions that benefit the community."
What are the benefits of sustainable practices in operations?,"Sustainable practices in operations reduce environmental impact, lower costs, and improve brand reputation, leading to long-term business success."
How to use machine learning for energy efficiency?,"Use machine learning for energy efficiency by monitoring usage patterns, predicting maintenance needs, and optimizing consumption to reduce costs and environmental impact."
